<?xml version="1.0"?>
<Fragment xmlns:xsi="http://www.w3.org/2001/XMLSchema-instance"
          xmlns="http://modic.io/ns"
          xsi:schemaLocation="http://modic.io/ns modicio_lang.xsd"
          is_open="true"
          running_time="2002-05-30T09:00:00"
          running_id="1"
          is_reference="true"
          variant_id="1"
          variant_name="main"
          variant_time="2023-08-10T09:00:00">

    <Model>
        <Node name="Project" uri="modicio:demo.project" is_abstract="false">
            <Annotation version_time="2023-08-10T09:00:00" version_id="1" variant_time="2023-08-10T09:00:00" variant_id="1"/>
            <Attribute uri="modicio:demo.project.title" name="Title" dType="phrase" />
            <Attribute uri="modicio:demo.project.deadline" name="Deadline" dType="datetime" />
            <AssociationRelation uri="modicio:demo.project.todos" name="Todos"
                target="modicio:demo.todo">
                <Interface>
                    <Point variant_time="2023-08-10T09:00:00" variant_id="1" />
                </Interface>
            </AssociationRelation>
            <Script uri="modicio:demo.myScript1" name="myScript1" action_type="ActionType" resolver="modicio:resolver">
                <any_value>
                    foo script ... a lot of scala code here
                </any_value>
            </Script>
            <Script uri="modicio:demo.myScript2" name="myScript2" action_type="AnotherActionType" resolver="modicio:resolver2">
                <any_value>
                    bar script ... a lot of scala code here
                </any_value>
            </Script>
        </Node>
        <Node name="Todos" uri="modicio:demo.todo" is_abstract="false">
            <Annotation version_time="2023-08-10T09:30:00" version_id="2" variant_time="2023-08-10T09:30:00" variant_id="2"/>
            <Attribute uri="modicio:demo.todo.title" name="Title" dType="string"/>
        </Node>
        <Node name="Epic" uri="modicio:demo.epic" is_abstract="false">
            <Annotation version_time="2023-08-10T09:30:00" version_id="2" variant_time="2023-08-10T09:30:00" variant_id="2"/>
            <Attribute uri="modicio:demo.epic.title" name="Title" dType="string"/>
            <ParentRelation uri="modicio:demo.todo"/>
        </Node>
        <Node name="Issues" uri="modicio:demo.issues" is_abstract="false">
            <Annotation version_time="2023-08-10T09:30:00" version_id="2" variant_time="2023-08-10T09:30:00" variant_id="2"/>
            <Composition uri="modicio:demo..issues.todo" role="role" target="modicio:demo.todo" public="true"/>
        </Node>
    </Model>

    <Instance name="myProject" modelRoot="modicio:demo.project" uri="modicio:instance.myProject">
        <Header></Header>
        <Object instanceOf="modicio:demo.project">
            <AttributeInstance attribute_uri="modicio:demo.project.title">
                <any_value>My Project Title</any_value>
            </AttributeInstance>
            <AttributeInstance attribute_uri="modicio:demo.project.deadline">
                <any_value>My Project Description</any_value>
            </AttributeInstance>
        </Object>
    </Instance>
</Fragment>